PMID,Title,Journal,AuthorList,PublicationYear
37456266,Clinical and Translational Science Personas: Expansion and use cases.,Journal of clinical and translational science,"['Gonzales S', 'Champieux R', 'Contaxis N', 'Denton AH', 'Hosseini M', 'Surkis A', 'Wescott A', 'Holmes K']",2023
37414539,"The NYU Data Catalog: a modular, flexible infrastructure for data discovery.",Journal of the American Medical Informatics Association : JAMIA,"['Yee M', 'Surkis A', 'Lamb I', 'Contaxis N']",2023
37101925,Engaging health sciences librarians on data ethics: case study on a pilot curriculum.,Journal of the Medical Library Association : JMLA,"['Contaxis N', 'LaPolla FW', 'Milliken G']",2022
36589297,Rigor and reproducibility instruction in academic medical libraries.,Journal of the Medical Library Association : JMLA,"['LaPolla FWZ', 'Bakker CJ', 'Exner N', 'Montnech T', 'Surkis A', 'Ye H']",2022
35143479,Ten simple rules for improving research data discovery.,PLoS computational biology,"['Contaxis N', 'Clark J', 'Dellureficio A', 'Gonzales S', 'Mannheimer S', 'Oxley PR', 'Ratajeski MA', 'Surkis A', 'Yarnell AM', 'Yee M', 'Holmes K']",2022
34629980,Piloting a long-term evaluation of library data workshops.,Journal of the Medical Library Association : JMLA,"['LaPolla FWZ', 'Contaxis N', 'Surkis A']",2021
28377684,Data Day to Day: building a community of expertise to address data skills gaps in an academic medical center.,Journal of the Medical Library Association : JMLA,"['Surkis A', 'LaPolla FW', 'Contaxis N', 'Read KB']",2017
28377680,"Improving data collection, documentation, and workflow in a dementia screening study.",Journal of the Medical Library Association : JMLA,"['Read KB', 'LaPolla FW', 'Tolea MI', 'Galvin JE', 'Surkis A']",2017
